{
  "schema_version": 1,
  "asset_id": "tg_20260604_105113_photo_001",
  "source": "telegram",
  "received_at": "2026-06-04T10:51:13Z",
  "telegram": {
    "chat_id_hash": "aaaaaaaaaaaaaaaaaaaaaaaaaaaaaaaaaaaaaaaaaaaaaaaaaaaaaaaaaaaaaaaa",
    "message_id": 12345,
    "file_id_hash": "bbbbbbbbbbbbbbbbbbbbbbbbbbbbbbbbbbbbbbbbbbbbbbbbbbbbbbbbbbbbbbbb",
    "file_unique_id": "AgADBAADb6cxG4x",
    "file_size": 1048576
  },
  "original": {
    "filename": "photo.jpg",
    "declared_mime": "image/jpeg",
    "detected_mime": "image/jpeg",
    "size_bytes": 1048576,
    "sha256": "cccccccccccccccccccccccccccccccccccccccccccccccccccccccccccccccc"
  },
  "storage": {
    "backend": "local_runtime",
    "bucket": null,
    "object_key": "telegram-assets/2026/06/04/tg_20260604_105113_photo_001/photo.jpg",
    "sha256": "cccccccccccccccccccccccccccccccccccccccccccccccccccccccccccccccc"
  },
  "policy": {
    "max_bytes": 20971520,
    "download_allowed": true,
    "retention": "runtime"
  }
}
